{
  "schema": "hebrinex.command_gateway.result",
  "version": "0.5",
  "root": "",
  "mode": "CheckOnly",
  "command_text": "",
  "purpose": "",
  "approval_id": "",
  "approval_status": "not_provided",
  "approval_reason": "",
  "decision": "block",
  "risk_class": "unknown",
  "requires_preflight": true,
  "requires_si": true,
  "writes": false,
  "executes": false,
  "mutation_contract": "none",
  "matched_pattern": "",
  "reason": "",
  "generated_preflight": {
    "enabled": true,
    "approval_id": "COMMAND-GATEWAY-REQUIRED",
    "action": "",
    "cwd": "",
    "read_set": "orquestador/security/command-risk-registry.yaml, orquestador/security/secrets-policy.yaml",
    "write_set": "InstanceRoot/runtime/gateway-rate.json when Apply is allowed",
    "command_tool": "",
    "network_git_external": "no by default",
    "risk": "unknown",
    "verification": "human review plus command evidence outside gateway",
    "expected_evidence": "SI approval, command output, exit code and redacted logs",
    "requires_si": true
  },
  "execution": {
    "attempted": false,
    "exit_code": null,
    "timed_out": false,
    "timeout_seconds": 30,
    "stdout": "",
    "stderr": ""
  },
  "next_step": "use generated_preflight before any execution"
}
